{
  "artifact": {
    "path": "heldout_tasks.jsonl",
    "row_count": 150,
    "sha256": "fc8822dd55556bd5475d6f07dc4b313a20e13757b961fb16ce06dddff5983921"
  },
  "contamination_audit": {
    "path": "contamination_audit.json",
    "sha256": "a2ec1a05b0aad02e9190c0ae14fd49ea27dafb258b7f138ebd731171e4f7e8be"
  },
  "created_at": "2026-07-18T00:00:00+00:00",
  "development_artifact": {
    "path": "development_tasks.jsonl",
    "policy": "May be used for candidate repair and model selection, but never for gradient updates.",
    "row_count": 120,
    "sha256": "4b9494407f48c1c608344094509050c58241e64e68ab324fbd2ffb540699f4ae"
  },
  "immutable": true,
  "manifest_sha256": "1ef22ea6abd4ea681a95f19cba11568e82a586c40045788ee9da033e41ade642",
  "policy": "Never use heldout_tasks.jsonl, its prompts, outputs, or task ids for training or hyperparameter selection.",
  "schema_version": "hfr.frozen_heldout_manifest.v1",
  "training_artifact": {
    "path": "train_trajectories.jsonl",
    "row_count": 800,
    "sha256": "0c6a9b26bf712151d722e72ce23082fc2d41ed5d599e75b115f1bf0463eda22a"
  }
}
